{
  "kind": "pack",
  "id": "python-refactor",
  "version": "2.0.0",
  "title": "Python Refactor",
  "description": "Safe Python refactoring imported from a skill folder.",
  "activation_class": "instruction",
  "side_effect_class": "none",
  "trust_tier": "org_validated",
  "requires_confirmation": false,
  "task_tags": [
    "python",
    "refactor",
    "tests"
  ],
  "compatible_roles": [
    "builder"
  ],
  "compatible_targets": [
    "codex-cli"
  ],
  "resources": [
    {
      "path": "packs/python-refactor/SKILL.md",
      "kind": "instruction",
      "required": true
    },
    {
      "path": "packs/python-refactor/references/testing.md",
      "kind": "example",
      "required": false
    }
  ],
  "imports": [
    {
      "ecosystem": "skill_md",
      "origin": "vendor/python-refactor",
      "digest": "sha256:dddddddddddddddddddddddddddddddd"
    }
  ]
}
