{
  "kind": "pack",
  "id": "repo-review-instructions",
  "version": "1.0.0",
  "title": "Repo Review Instructions",
  "description": "Curated review procedure with correctness-first instructions.",
  "activation_class": "instruction",
  "side_effect_class": "none",
  "trust_tier": "first_party_validated",
  "requires_confirmation": false,
  "task_tags": [
    "review",
    "pr",
    "correctness"
  ],
  "compatible_roles": [
    "reviewer"
  ],
  "compatible_targets": [
    "claude-code"
  ],
  "resources": [
    {
      "path": "packs/repo-review-instructions/SKILL.md",
      "kind": "instruction",
      "required": true
    }
  ]
}
