{
  "kind": "pack",
  "id": "library-organization-guide",
  "version": "1.0.0",
  "title": "metactl Library Steward",
  "description": "Guide for organizing metactl artifacts into packs and profiles and managing the right config layer for each change.",
  "activation_class": "instruction",
  "side_effect_class": "none",
  "trust_tier": "first_party_validated",
  "requires_confirmation": false,
  "task_tags": [
    "metactl",
    "library",
    "organization",
    "profiles",
    "authoring"
  ],
  "compatible_roles": [
    "builder",
    "reviewer",
    "release-manager"
  ],
  "compatible_targets": [
    "claude-code",
    "codex-cli",
    "cursor",
    "gemini-cli",
    "openclaw"
  ],
  "resources": [
    {
      "path": "packs/library-organization-guide/SKILL.md",
      "kind": "instruction",
      "required": true,
      "surface_relevance": "always_on"
    },
    {
      "path": "packs/library-organization-guide/OPERATIONS.md",
      "kind": "instruction",
      "required": true,
      "surface_relevance": "suppressible"
    }
  ],
  "imports": [
    {
      "ecosystem": "first_party",
      "origin": "starter-library"
    }
  ],
  "lifecycle": {
    "status": "active",
    "verified_targets": [
      "claude-code",
      "codex-cli",
      "cursor",
      "gemini-cli",
      "openclaw"
    ],
    "last_verified_at": "2026-04-22T12:00:00Z",
    "evidence_refs": [
      "evals/search/starter-search-eval.json"
    ]
  },
  "metadata": {
    "pack_status": "starter-promoted"
  }
}
