{
  "kind": "pack",
  "id": "metactl-skill-improvement",
  "version": "1.0.0",
  "title": "metactl Skill Improvement",
  "description": "Turn feedback about a skill, command, rule, or projected agent surface into a canonical metactl library improvement, then optionally preview or apply the projection to one repo or a fleet.",
  "activation_class": "instruction",
  "side_effect_class": "fs_write",
  "trust_tier": "first_party_validated",
  "requires_confirmation": true,
  "task_tags": [
    "metactl",
    "library",
    "authoring",
    "skills",
    "commands",
    "feedback",
    "fleet"
  ],
  "compatible_roles": [
    "builder",
    "reviewer",
    "release-manager"
  ],
  "compatible_targets": [
    "claude-code",
    "codex-cli",
    "cursor",
    "gemini-cli",
    "openclaw"
  ],
  "resources": [
    {
      "path": "packs/metactl-skill-improvement/SKILL.md",
      "kind": "instruction",
      "required": true,
      "surface_relevance": "always_on"
    },
    {
      "path": "packs/metactl-skill-improvement/commands/metactl-improve-skill.md",
      "kind": "command",
      "required": true
    },
    {
      "path": "packs/metactl-skill-improvement/references/improvement-record-template.md",
      "kind": "example",
      "required": false,
      "surface_relevance": "suppressible"
    }
  ],
  "imports": [
    {
      "ecosystem": "first_party",
      "origin": "starter-library"
    }
  ],
  "lifecycle": {
    "status": "active",
    "verified_targets": [
      "claude-code",
      "codex-cli",
      "cursor",
      "gemini-cli",
      "openclaw"
    ],
    "last_verified_at": "2026-05-17T00:00:00Z",
    "evidence_refs": [
      "tests:starter-library"
    ]
  },
  "metadata": {
    "author": "pylit-ai",
    "version": "1.0",
    "visibility_scope": "public"
  }
}
