{
  "kind": "pack",
  "id": "python-refactor",
  "version": "2.0.0",
  "title": "Duplicate Python Refactor",
  "description": "Intentional duplicate for loader tests.",
  "activation_class": "instruction",
  "side_effect_class": "none",
  "trust_tier": "org_validated",
  "requires_confirmation": false,
  "task_tags": ["python", "refactor"],
  "resources": []
}
